{"candidate_id":"dm:memory-candidate:v1:039GEc-QPbodogd4vXhl2A0vrO4Eg31WiynTavgS-rw","checkpoint":{"being_ref":"dm:being:v1:rXPS-dJw3Inkmla3gM_RAckdAmqw4If5htSQnP_d03g","body_evidence_state":"verified","captured_at_ms":1800000000000,"evidence_refs":["10000000-0000-4000-8000-000000000030"],"lane_event_ids":[],"lane_head":null,"lane_state":"empty","ledger_state_hash":"caedbdec58333a2a5b1f5828846a17fc29616c94a59bb9a3afd6b111efe1a9c7","local_origin":{"body_ref":"cluster:vector:compaii","embodiment_id":"embodiment:vector","incarnation_id":"incarnation:vector:0","principal_id":"compaii@vector"},"manifest_hash":"e7aedab24df9c9aa59be047537f703720b5684b3c37eab9ad8c82a1e91d2569d","projection_hash":"e02a16be4b70857e139e12205a6814a3867ca4975bb2499bed5003c113940e4d","schema":"dm.memory.checkpoint/v1"},"decision_id":"dm:memory-decision:v1:GUrag1tIyzvVTo6OZbCQvRCqQ4Q_1xNpKCBNZiRGsUc","evaluated_at_ms":1800000000000,"event_preview":{"kind":"memory.recorded","payload":{"author_me_id":"dm:being:v1:rXPS-dJw3Inkmla3gM_RAckdAmqw4If5htSQnP_d03g","candidate_id":"dm:memory-candidate:v1:039GEc-QPbodogd4vXhl2A0vrO4Eg31WiynTavgS-rw","category":"personal-experience","content_ref":{"byte_length":21,"classification":"personal","content_id":"dm:memory-content:v1:1Hk0Ax1qVRAcTtCqW9-p_en7ffU8oiqjmurMetVC0YE","media_type":"text/plain","schema":"dm.memory.content-ref/v1","sha256":"42b9fbaa3618c67a107cc818bc1a5be74d96607da05c873d34dd42bf209e3bd8"},"context":"autobiographical","decision_id":"dm:memory-decision:v1:GUrag1tIyzvVTo6OZbCQvRCqQ4Q_1xNpKCBNZiRGsUc","evidence_refs":["10000000-0000-4000-8000-000000000030"],"memory_id":"20000000-0000-4000-8000-000000000030","operation":"assert","policy_id":"dm:memory-policy:v1:sb0xj-M0SB-rgFySwoRICNHWORHhmQcds8uVVQpxzCk","predecessor_decision_id":null,"predecessor_event_id":null,"predecessor_hash":null,"schema":"dm.memory.record/v1","sequence":1},"sensitivity":"personal","subject":"dm:being:v1:rXPS-dJw3Inkmla3gM_RAckdAmqw4If5htSQnP_d03g"},"expires_at_ms":1800000300000,"outcome":"review-required","plan_id":"dm:memory-plan:v1:vDHj2Ml-DkZoujOLPDFcz_vznbopGBRGmlDQC-7Baeg","policy_id":"dm:memory-policy:v1:sb0xj-M0SB-rgFySwoRICNHWORHhmQcds8uVVQpxzCk","predecessor_decision_id":null,"reasons":["sensitive-contradiction"],"schema":"dm.memory.transition-plan/v1","subject_me_id":"dm:being:v1:rXPS-dJw3Inkmla3gM_RAckdAmqw4If5htSQnP_d03g"}
